Dublin Core:Identifier,upload_url,tags,Item Type Metadata:Original Format,Item Type Metadata:Physical Dimensions,Dublin Core:Title,Dublin Core:Description,Dublin Core:Creator,Dublin Core:Source,Dublin Core:Publisher,Dublin Core:Date,Dublin Core:Rights,Dublin Core:Format,Dublin Core:Language,Dublin Core:Type
zoo_kcz_africa_ph_05,https://bassettassociates.s3.amazonaws.com/zoo/kcz/africa/zoo_kcz_africa_ph_05.tif,"zoo,Kansas City",photo,3519x2340,Visitors viewing an exhibit from a walkway surrounded by rockwork,,Bassett Associates,Bassett Associates files,James H. Bassett,,Available under a Creative Commons Attribution 4.0 International (CC BY 4.0) license,image/tiff,,StillImage
zoo_kcz_africa_ph_06,https://bassettassociates.s3.amazonaws.com/zoo/kcz/africa/zoo_kcz_africa_ph_06.tif,"zoo,Kansas City,animal",photo,1342x1970,Giraffe and antelope,,Bassett Associates,Bassett Associates files,James H. Bassett,,Available under a Creative Commons Attribution 4.0 International (CC BY 4.0) license,image/tiff,,StillImage
zoo_kcz_africa_sk_00,https://bassettassociates.s3.amazonaws.com/zoo/kcz/africa/zoo_kcz_africa_sk_00.tif,"zoo,Kansas City,artwork",sketch,3546x1485,Exhibit area elevation drawing,,James H. Bassett,Bassett Associates files,James H. Bassett,,Available under a Creative Commons Attribution 4.0 International (CC BY 4.0) license,image/tiff,en,StillImage
zoo_kcz_aust_ph_00,https://bassettassociates.s3.amazonaws.com/zoo/kcz/aust/zoo_kcz_aust_ph_00.tif,"zoo,Kansas City,animal",photo,1944x1594,Sheep station with kangaroos in foreground,,Bassett Associates,Bassett Associates files,James H. Bassett,,Available under a Creative Commons Attribution 4.0 International (CC BY 4.0) license,image/tiff,,StillImage
zoo_kcz_aust_ph_01,https://bassettassociates.s3.amazonaws.com/zoo/kcz/aust/zoo_kcz_aust_ph_01.tif,"zoo,Kansas City",photo,2948x1973,Visitors with children in front of train station,,Bassett Associates,Bassett Associates files,James H. Bassett,,Available under a Creative Commons Attribution 4.0 International (CC BY 4.0) license,image/tiff,,StillImage
zoo_kcz_aust_ph_02,https://bassettassociates.s3.amazonaws.com/zoo/kcz/aust/zoo_kcz_aust_ph_02.tif,"zoo,Kansas City,animal",photo,3038x2307,Children petting emus in the petting area,,Bassett Associates,Bassett Associates files,James H. Bassett,,Available under a Creative Commons Attribution 4.0 International (CC BY 4.0) license,image/tiff,,StillImage
zoo_kcz_aust_sk_00,https://bassettassociates.s3.amazonaws.com/zoo/kcz/aust/zoo_kcz_aust_sk_00.tif,"zoo,Kansas City,artwork",sketch,2963x1418,"Sheep station with petting area in the foreground, Australian Outback at Kansas City Zoo",,James H. Bassett,Bassett Associates files,James H. Bassett,,Available under a Creative Commons Attribution 4.0 International (CC BY 4.0) license,image/tiff,,StillImage
zoo_kcz_chimp_ph_00,https://bassettassociates.s3.amazonaws.com/zoo/kcz/chimp/zoo_kcz_chimp_ph_00.tif,"zoo,Kansas City,Africa,chimpanzee",photo,34782348,Photograph of chimpanzee exhibit from viewing building,"Photograph of the Kansas City Zoo chimpanzee exhibit taken from the viewing shelter, showing chimpanzees and visitors.",Bassett Associates,Bassett Associates files,James H. Bassett,,Available under a Creative Commons Attribution 4.0 International (CC BY 4.0) license,image/tiff,,StillImage
zoo_kcz_chimp_ph_01,https://bassettassociates.s3.amazonaws.com/zoo/kcz/chimp/zoo_kcz_chimp_ph_01.tif,"zoo,Kansas City,Africa,chimpanzee",photo,34232361,Photograph of chimpanzees in exhibit,Photograph of the Kansas City Zoo chimpanzee exhibit showing chimpanzees in their exhibit area.,Bassett Associates,Bassett Associates files,James H. Bassett,,Available under a Creative Commons Attribution 4.0 International (CC BY 4.0) license,image/tiff,,StillImage
zoo_kcz_chimp_sk_00,https://bassettassociates.s3.amazonaws.com/zoo/kcz/chimp/zoo_kcz_chimp_sk_00.tif,"zoo,Kansas City,Africa,chimpanzee,section",sketch,34782279,Chimpanzee exhibit cross section,"Cross section color rendering of the Kansas City Zoo chimpanzee exhibit as designed, including the exhibit area and viewing shelter.",James H. Bassett,Bassett Associates files,James H. Bassett,,Available under a Creative Commons Attribution 4.0 International (CC BY 4.0) license,image/tiff,en,StillImage
zoo_kcz_chimp_sk_01,https://bassettassociates.s3.amazonaws.com/zoo/kcz/chimp/zoo_kcz_chimp_sk_01.tif,"zoo,Kansas City,Africa,chimpanzee",sketch,34512334,Artistic sketch of chimpanzee exhibit,"Color artist's sketch of the completed Kansas City Zoo chimpanzee exhibit, showing chimpanzees in the exhibit and visitors in the shelter.",James H. Bassett,Bassett Associates files,James H. Bassett,,Available under a Creative Commons Attribution 4.0 International (CC BY 4.0) license,image/tiff,en,StillImage
zoo_kcz_master_pl_00,https://bassettassociates.s3.amazonaws.com/zoo/kcz/master/zoo_kcz_master_pl_00.tif,"zoo,Kansas City,masterplan",plan,2376x3546,Kansas City Zoo masterplan,The Kansas City Zoo masterplan guided a major renovation of the zoo.,Bassett Associates,Bassett Associates files,James H. Bassett,,Available under a Creative Commons Attribution 4.0 International (CC BY 4.0) license,image/tiff,en,StillImage
zoo_kcz_master_sk_00,https://bassettassociates.s3.amazonaws.com/zoo/kcz/master/zoo_kcz_master_sk_00.tif,"zoo,Kansas City,artwork",sketch,3451x2334,Gombe Stream Chimp Preserve,,James H. Bassett,Bassett Associates files,James H. Bassett,,Available under a Creative Commons Attribution 4.0 International (CC BY 4.0) license,image/tiff,,StillImage
zoo_kcz_master_sk_01,https://bassettassociates.s3.amazonaws.com/zoo/kcz/master/zoo_kcz_master_sk_01.tif,"zoo,Kansas City,artwork",sketch,3375x2250,Elephant Sanctuary,,James H. Bassett,Bassett Associates files,James H. Bassett,,Available under a Creative Commons Attribution 4.0 International (CC BY 4.0) license,image/tiff,,StillImage
zoo_kcz_master_sk_02,https://bassettassociates.s3.amazonaws.com/zoo/kcz/master/zoo_kcz_master_sk_02.tif,"zoo,Kansas City,artwork",sketch,3506x2403,Australian Outback,,James H. Bassett,Bassett Associates files,James H. Bassett,,Available under a Creative Commons Attribution 4.0 International (CC BY 4.0) license,image/tiff,,StillImage
zoo_kcz_master_sk_03,https://bassettassociates.s3.amazonaws.com/zoo/kcz/master/zoo_kcz_master_sk_03.tif,"zoo,Kansas City,artwork",sketch,3602x2458,African Plains,,James H. Bassett,Bassett Associates files,James H. Bassett,,Available under a Creative Commons Attribution 4.0 International (CC BY 4.0) license,image/tiff,,StillImage
report_findlay_1965,https://bassettassociates.s3.amazonaws.com/report/findlay_1965.pdf,"campus,findlay,report",printed report,,Findlay College Campus Plan: A Concept for Future Physical Development,A study to provide the proper framework for the physical expansion of Findlay College,James H. Bassett,Bassett Associates files,James H. Bassett,1965,Available under a Creative Commons Attribution 4.0 International (CC BY 4.0) license,application/pdf,en,Text
report_lima_cbd_1975,https://bassettassociates.s3.amazonaws.com/report/lima_cbd_1975.pdf,"downtown,lima,report",printed report,,"Urban Design Plan: Lima, Ohio Central Business District",Design concepts and recommendations of an Urban Design Plan for Lima's Central Business District (CBD),"James H. Bassett, Inc.",Bassett Associates files,James H. Bassett,1975,Available under a Creative Commons Attribution 4.0 International (CC BY 4.0) license,application/pdf,en,Text
report_mary_holmes,https://bassettassociates.s3.amazonaws.com/report/mary_holmes.pdf,"campus,report",printed report,,Mary Holmes Campus Plan,"A report recording the approach to planning the future development of facilities at Mary Holmes College, West Point, Mississippi.",James H. Bassett,Bassett Associates files,James H. Bassett,c. 1969,Available under a Creative Commons Attribution 4.0 International (CC BY 4.0) license,application/pdf,en,Text
report_onu_1989,https://bassettassociates.s3.amazonaws.com/report/onu_1989.pdf,"campus,ONU,report",printed report,,"Master Plan for Development: Ohio Northern University, Ada, Ohio",A summary of master development planning and problem solving at Ohio Northern University from 1984-1989,Bassett Associates,Bassett Associates files,James H. Bassett,1989,Available under a Creative Commons Attribution 4.0 International (CC BY 4.0) license,application/pdf,en,Text
report_chillicothe_1982,https://bassettassociates.s3.amazonaws.com/report/chillicothe_1982.pdf,"downtown,report",printed report,,"Streetscape: Chillicothe, Ohio","The Chillicothe Downtown Streetscape Plan outlines basic improvements in the pubicl right-of-ways, designed to encourage reinvestment and to promote a prosperous urban core for the  community","James H. Bassett, Inc.",Bassett Associates files,James H. Bassett,1982,Available under a Creative Commons Attribution 4.0 International (CC BY 4.0) license,application/pdf,en,Text
report_akron_zoo_1977,https://bassettassociates.s3.amazonaws.com/report/akron_zoo_1977.pdf,"zoo,masterplan,report",printed report,,The Akron Childrens Zoo Development Plan,"To fulfil for the citizens of Akron recreation, education, conservation, and research through development of the Childrens Zoo",James H. Bassett and Earl B. Wells,Bassett Associates files,James H. Bassett,1977,Available under a Creative Commons Attribution 4.0 International (CC BY 4.0) license,application/pdf,en,Text
report_greenville_zoo_1984,https://bassettassociates.s3.amazonaws.com/report/greenville_zoo_1984.pdf,"zoo,masterplan,report",printed report,,"Greenville Zoo Master Plan of Redevelopment, Greenville, South Carolina",A long-range plan intended to provide a design and implementation guide to effectively deal with current and future development of the zoo.,"James H. Bassett, Inc. and Earl B. Wells",Bassett Associates files,James H. Bassett,1984,Available under a Creative Commons Attribution 4.0 International (CC BY 4.0) license,application/pdf,en,Text
exhibit_bgu_po_00,https://bassettassociates.s3.amazonaws.com/exhibit/exhibit_bgu_po_00.tif,"2001 exhibit,campus,BGSU",poster,3675x2800,Bowling Green State University,"Images, site plan, and description of significant projects at BGSU",Bassett Associates,Bassett Associates files,James H. Bassett,2001,Available under a Creative Commons Attribution 4.0 International (CC BY 4.0) license,image/tiff,en,StillImage
exhibit_blu_po_00,https://bassettassociates.s3.amazonaws.com/exhibit/exhibit_blu_po_00.tif,"2001 exhibit,campus,Bluffton",poster,3675x2800,Bluffton College (plans),"Plans and description of site development, with photos",Bassett Associates,Bassett Associates files,James H. Bassett,2001,Available under a Creative Commons Attribution 4.0 International (CC BY 4.0) license,image/tiff,en,StillImage
exhibit_blu_po_01,https://bassettassociates.s3.amazonaws.com/exhibit/exhibit_blu_po_01.tif,"2001 exhibit,campus,Bluffton",poster,3675x2800,Bluffton College (2010 Master Plan),Description of the 2000-2010 Master Plan with plan images,Bassett Associates,Bassett Associates files,James H. Bassett,2001,Available under a Creative Commons Attribution 4.0 International (CC BY 4.0) license,image/tiff,en,StillImage
exhibit_fin_po_00,https://bassettassociates.s3.amazonaws.com/exhibit/exhibit_fin_po_00.tif,"2001 exhibit,campus,Findlay",poster,3675x2800,The University of Findlay,"Overview of planning history with plans, a sketch, and photo",Bassett Associates,Bassett Associates files,James H. Bassett,2001,Available under a Creative Commons Attribution 4.0 International (CC BY 4.0) license,image/tiff,en,StillImage
exhibit_long_po_00,https://bassettassociates.s3.amazonaws.com/exhibit/exhibit_long_po_00.tif,"2001 exhibit,corporate",poster,3675x2800,Longaberger Corporation Home Office,"Images, plans, and site description of the Longaberger headquarters.",Bassett Associates,Bassett Associates files,James H. Bassett,2001,Available under a Creative Commons Attribution 4.0 International (CC BY 4.0) license,image/tiff,en,StillImage
exhibit_onu_po_00,https://bassettassociates.s3.amazonaws.com/exhibit/exhibit_onu_po_00.tif,"2001 exhibit,campus,ONU",poster,3675x2800,Ohio Northern University,Overview of ONU design principles with plans and photos,Bassett Associates,Bassett Associates files,James H. Bassett,2001,Available under a Creative Commons Attribution 4.0 International (CC BY 4.0) license,image/tiff,en,StillImage
exhibit_wendys_po_00,https://bassettassociates.s3.amazonaws.com/exhibit/exhibit_wendys_po_00.tif,"2001 exhibit,corporate",poster,3675x2800,"Wendy's International, Inc. Corporate Headquarters, Dublin, Ohio",Description of key features of design with photos and a plan as background ,Bassett Associates,Bassett Associates files,James H. Bassett,2001,Available under a Creative Commons Attribution 4.0 International (CC BY 4.0) license,image/tiff,en,StillImage
zoo_bla_sk_00,https://bassettassociates.s3.amazonaws.com/zoo/bla/zoo_bla_sk_00.tif,"zoo,Blank Park,artwork",sketch,4500x2850,"African plains watering hole, Blank Park Zoo, Des Moines, Iowa",,James H. Bassett,Bassett Associates files,James H. Bassett,2000,Available under a Creative Commons Attribution 4.0 International (CC BY 4.0) license,image/tiff,,StillImage
exhibit_title_po_00,https://bassettassociates.s3.amazonaws.com/exhibit/exhibit_title_po_00.tif,2001 exhibit,poster,3675x2800,Exhibit announcement,"Title, sponsor, and date information about the exhibit.",Bassett Associates,Bassett Associates files,James H. Bassett,2001,Available under a Creative Commons Attribution 4.0 International (CC BY 4.0) license,image/tiff,en,StillImage
exhibit_title_po_01,https://bassettassociates.s3.amazonaws.com/exhibit/exhibit_title_po_01.tif,2001 exhibit,poster,2100x1600,Introductory panel,Descriptions of the four foci of the exhibit and a quote from James H. Bassett,Bassett Associates,Bassett Associates files,James H. Bassett,2001,Available under a Creative Commons Attribution 4.0 International (CC BY 4.0) license,image/tiff,en,StillImage
exhibit_title_po_02,https://bassettassociates.s3.amazonaws.com/exhibit/exhibit_title_po_02.tif,2001 exhibit,poster,5250x1630,Art and Landscape Architecture,Subtitle with a listing of projects with a strong art emphasis,Bassett Associates,Bassett Associates files,James H. Bassett,2001,Available under a Creative Commons Attribution 4.0 International (CC BY 4.0) license,image/tiff,en,StillImage
exhibit_title_po_03,https://bassettassociates.s3.amazonaws.com/exhibit/exhibit_title_po_03.tif,2001 exhibit,poster,5250x1608,Science and Landscape Architecture,Subtitle with a listing of projects with important natural science components,Bassett Associates,Bassett Associates files,James H. Bassett,2001,Available under a Creative Commons Attribution 4.0 International (CC BY 4.0) license,image/tiff,en,StillImage
exhibit_title_po_04,https://bassettassociates.s3.amazonaws.com/exhibit/exhibit_title_po_04.tif,2001 exhibit,poster,5250x1429,Architecture and Landscape Architecture,Subtitle with a listing of projects with strong landscape and architectural relationships,Bassett Associates,Bassett Associates files,James H. Bassett,2001,Available under a Creative Commons Attribution 4.0 International (CC BY 4.0) license,image/tiff,en,StillImage
exhibit_title_po_05,https://bassettassociates.s3.amazonaws.com/exhibit/exhibit_title_po_05.tif,2001 exhibit,poster,5250x2481,Engineering and Landscape Architecture,Subtitle with a listing of projects with major engineering components,Bassett Associates,Bassett Associates files,James H. Bassett,2001,Available under a Creative Commons Attribution 4.0 International (CC BY 4.0) license,image/tiff,en,StillImage
exhibit_amfl_po_00,https://bassettassociates.s3.amazonaws.com/exhibit/exhibit_amfl_po_00.tif,2001 exhibit,poster,3675x2800,AmeriFlora '92,Photos and plans from the Lakes and Cascades display,Bassett Associates,Bassett Associates files,James H. Bassett,2001,Available under a Creative Commons Attribution 4.0 International (CC BY 4.0) license,image/tiff,en,StillImage
exhibit_col_po_00,https://bassettassociates.s3.amazonaws.com/exhibit/exhibit_col_po_00.tif,"2001 exhibit,Columbus",poster,3675x2800,Columbus Zoo,"Sketches, plans, and photos of the West African Forest and North American Wetlands exhibits of the Columbus Zoological Gardens",Bassett Associates,Bassett Associates files,James H. Bassett,2001,Available under a Creative Commons Attribution 4.0 International (CC BY 4.0) license,image/tiff,en,StillImage
exhibit_ftw_po_00,https://bassettassociates.s3.amazonaws.com/exhibit/exhibit_ftw_po_00.tif,"2001 exhibit,Fort Wayne",poster,3675x2800,Ft. Wayne Childrens Zoo Australian Adventure,Describes the major features and illustrates with photos and a plan,Bassett Associates,Bassett Associates files,James H. Bassett,2001,Available under a Creative Commons Attribution 4.0 International (CC BY 4.0) license,image/tiff,en,StillImage
exhibit_ftw_po_01,https://bassettassociates.s3.amazonaws.com/exhibit/exhibit_ftw_po_01.tif,"2001 exhibit,Fort Wayne",poster,3675x2800,Ft. Wayne Childrens Zoo Indonesian Rainforest,"Illustrates the rainforest exhibit with photos, sketches, and a plan",Bassett Associates,Bassett Associates files,James H. Bassett,2001,Available under a Creative Commons Attribution 4.0 International (CC BY 4.0) license,image/tiff,en,StillImage
exhibit_hist_po_00,https://bassettassociates.s3.amazonaws.com/exhibit/exhibit_hist_po_00.tif,2001 exhibit,poster,3675x2800,Jim Bassett: A Personal History,Describes the experiences that influenced James H. Bassett's career as a landscape architect,Bassett Associates,Bassett Associates files,James H. Bassett,2001,Available under a Creative Commons Attribution 4.0 International (CC BY 4.0) license,image/tiff,en,StillImage
exhibit_kcz_po_00,https://bassettassociates.s3.amazonaws.com/exhibit/exhibit_kcz_po_00.tif,"2001 exhibit,Kansas City",poster,3675x2800,Kansas City Zoo Master Plan,Illustrates the master plan with sketches of the exhibits,Bassett Associates,Bassett Associates files,James H. Bassett,2001,Available under a Creative Commons Attribution 4.0 International (CC BY 4.0) license,image/tiff,en,StillImage
exhibit_kcz_po_01,https://bassettassociates.s3.amazonaws.com/exhibit/exhibit_kcz_po_01.tif,"2001 exhibit,Kansas City",poster,3675x2800,African Plains at the Kansas City Zoo,Describes the plains exhibit and illustrates with photos and a sketch,Bassett Associates,Bassett Associates files,James H. Bassett,2001,Available under a Creative Commons Attribution 4.0 International (CC BY 4.0) license,image/tiff,en,StillImage
exhibit_kcz_po_02,https://bassettassociates.s3.amazonaws.com/exhibit/exhibit_kcz_po_02.tif,"2001 exhibit,Kansas City",poster,1050x800,Gombe Stream Chimp Preserve at the Kansas City Zoo,The chimp exhibit is illustrated with photographs and a section sketch,Bassett Associates,Bassett Associates files,James H. Bassett,2001,Available under a Creative Commons Attribution 4.0 International (CC BY 4.0) license,image/tiff,en,StillImage
exhibit_kcz_po_03,https://bassettassociates.s3.amazonaws.com/exhibit/exhibit_kcz_po_03.tif,"2001 exhibit,Kansas City",poster,1074x848,The Australian Outback at the Kansas City Zoo,The outback experience is described and illustrated with a sketch and photos,Bassett Associates,Bassett Associates files,James H. Bassett,2001,Available under a Creative Commons Attribution 4.0 International (CC BY 4.0) license,image/tiff,en,StillImage
exhibit_lim_po_00,https://bassettassociates.s3.amazonaws.com/exhibit/exhibit_lim_po_00.tif,"2001 exhibit,Lima",poster,3675x2800,"Lima, Ohio 1975","The 1975 Uban Design Plan is described and illustrated with a plan, sketch, and photos",Bassett Associates,Bassett Associates files,James H. Bassett,2001,Available under a Creative Commons Attribution 4.0 International (CC BY 4.0) license,image/tiff,en,StillImage
exhibit_lim_po_01,https://bassettassociates.s3.amazonaws.com/exhibit/exhibit_lim_po_01.tif,"2001 exhibit,Lima",poster,3675x2800,"Lima, Ohio 1989",Features of the 1989 redeveloment plan are illustrated with a plan and photos,Bassett Associates,Bassett Associates files,James H. Bassett,2001,Available under a Creative Commons Attribution 4.0 International (CC BY 4.0) license,image/tiff,en,StillImage
exhibit_lim_po_02,https://bassettassociates.s3.amazonaws.com/exhibit/exhibit_lim_po_02.tif,"2001 exhibit,Lima",poster,3675x2800,"Lima, Ohio 1994",The 1994 Ottawa River Corridor Master Plan is illustrated with plans and sketches,Bassett Associates,Bassett Associates files,James H. Bassett,2001,Available under a Creative Commons Attribution 4.0 International (CC BY 4.0) license,image/tiff,en,StillImage
exhibit_lim_po_03,https://bassettassociates.s3.amazonaws.com/exhibit/exhibit_lim_po_03.tif,"2001 exhibit,Lima",poster,3675x2800,"Lima, Ohio 2001",The 2001 Urban Design plan is described and illustrated with plans,Bassett Associates,Bassett Associates files,James H. Bassett,2001,Available under a Creative Commons Attribution 4.0 International (CC BY 4.0) license,image/tiff,en,StillImage
exhibit_limit_po_00,https://bassettassociates.s3.amazonaws.com/exhibit/exhibit_limit_po_00.tif,2001 exhibit,poster,3675x2800,The Limited,Site plans for the corporate headquarters and distribution center are shown with photos,Bassett Associates,Bassett Associates files,James H. Bassett,2001,Available under a Creative Commons Attribution 4.0 International (CC BY 4.0) license,image/tiff,en,StillImage
exhibit_mrf_po_00,https://bassettassociates.s3.amazonaws.com/exhibit/exhibit_mrf_po_00.tif,"2001 exhibit,Muirfield",poster,3675x2800,Muirfield Village analyses,"Soils, plant life, slope, and hydrology inventories and analyses are illustrated",Bassett Associates,Bassett Associates files,James H. Bassett,2001,Available under a Creative Commons Attribution 4.0 International (CC BY 4.0) license,image/tiff,en,StillImage
exhibit_mrf_po_01,https://bassettassociates.s3.amazonaws.com/exhibit/exhibit_mrf_po_01.tif,"2001 exhibit,Muirfield",poster,3675x2800,Muirfield Village land use,Watershed and land use distribution plans are shown along with photos,Bassett Associates,Bassett Associates files,James H. Bassett,2001,Available under a Creative Commons Attribution 4.0 International (CC BY 4.0) license,image/tiff,en,StillImage
exhibit_mrf_po_02,https://bassettassociates.s3.amazonaws.com/exhibit/exhibit_mrf_po_02.tif,"2001 exhibit,Muirfield",poster,3675x2800,Muirfield Village transportation,"The transportation infrastructure of Muirfield Village is illustrated with a plan, sketch, and photos",Bassett Associates,Bassett Associates files,James H. Bassett,2001,Available under a Creative Commons Attribution 4.0 International (CC BY 4.0) license,image/tiff,en,StillImage
exhibit_mrf_po_03,https://bassettassociates.s3.amazonaws.com/exhibit/exhibit_mrf_po_03.tif,"2001 exhibit,Muirfield",poster,3675x2800,Muirfield Village housing concepts,"Planning for distribution of homes is illustrated by plans, a sketch, and photos",Bassett Associates,Bassett Associates files,James H. Bassett,2001,Available under a Creative Commons Attribution 4.0 International (CC BY 4.0) license,image/tiff,en,StillImage
exhibit_oclc_po_00,https://bassettassociates.s3.amazonaws.com/exhibit/exhibit_oclc_po_00.tif,2001 exhibit,poster,3675x2800,"Online Computer Library Corporation, Dublin, Ohio",The use of stormwater lakes as a landscaping feature is illustrated with a plan and photos,Bassett Associates,Bassett Associates files,James H. Bassett,2001,Available under a Creative Commons Attribution 4.0 International (CC BY 4.0) license,image/tiff,en,StillImage
exhibit_ph_00,https://bassettassociates.s3.amazonaws.com/exhibit/exhibit_ph_00.jpg,2001 exhibit,photo,1600x1200,James H. Bassett exhibition entrance,Photo showing the entrance to the Artspace/Lima retrospective exhibition,Bassett Associates,Bassett Associates files,James H. Bassett,2001,Available under a Creative Commons Attribution 4.0 International (CC BY 4.0) license,image/jpeg,,StillImage
exhibit_ph_01,https://bassettassociates.s3.amazonaws.com/exhibit/exhibit_ph_01.jpg,2001 exhibit,photo,1600x1200,Lengthwise view of the gallery,View of the James H. Bassett retrospective exhibition showing informational panels and artworks,Bassett Associates,Bassett Associates files,James H. Bassett,2001,Available under a Creative Commons Attribution 4.0 International (CC BY 4.0) license,image/jpeg,,StillImage
exhibit_ph_02,https://bassettassociates.s3.amazonaws.com/exhibit/exhibit_ph_02.jpg,2001 exhibit,photo,1600x1200,Three dimensional models,Two 3D models occupy the central part of the exhibition,Bassett Associates,Bassett Associates files,James H. Bassett,2001,Available under a Creative Commons Attribution 4.0 International (CC BY 4.0) license,image/jpeg,,StillImage
exhibit_ph_03,https://bassettassociates.s3.amazonaws.com/exhibit/exhibit_ph_03.jpg,2001 exhibit,photo,1600x1200,Muirfield Village plan,A large format plan of Muirfield Village hangs from the ceiling of the exhibition hall,Bassett Associates,Bassett Associates files,James H. Bassett,2001,Available under a Creative Commons Attribution 4.0 International (CC BY 4.0) license,image/jpeg,,StillImage
exhibit_ph_04,https://bassettassociates.s3.amazonaws.com/exhibit/exhibit_ph_04.jpg,2001 exhibit,photo,1600x1200,Parkway and Muirfield panels,An enlargment of the Muirfiled parkway plan snakes through the illustrative panels about the project,Bassett Associates,Bassett Associates files,James H. Bassett,2001,Available under a Creative Commons Attribution 4.0 International (CC BY 4.0) license,image/jpeg,,StillImage
