Dublin Core:Identifier,upload_url,tags,Item Type Metadata:Original Format,Item Type Metadata:Physical Dimensions,Dublin Core:Title,Dublin Core:Description,Dublin Core:Creator,Dublin Core:Source,Dublin Core:Publisher,Dublin Core:Date,Dublin Core:Rights,Dublin Core:Format,Dublin Core:Language,Dublin Core:Type
art_sk_00,https://bassettassociates.s3.amazonaws.com/art/art_sk_00.tif,artwork,sketch,2250x1500,Animal,,James H. Bassett,Bassett Associates files,James H. Bassett,,Available under a Creative Commons Attribution 4.0 International (CC BY 4.0) license,image/tiff,,StillImage
art_sk_01,https://bassettassociates.s3.amazonaws.com/art/art_sk_01.tif,artwork,sketch,2464x3083,Clock,,James H. Bassett,Bassett Associates files,James H. Bassett,1949,Available under a Creative Commons Attribution 4.0 International (CC BY 4.0) license,image/tiff,,StillImage
art_sk_02,https://bassettassociates.s3.amazonaws.com/art/art_sk_02.tif,artwork,sketch,2525x2105,"Lippincott Farm, 1948",,James H. Bassett,Bassett Associates files,James H. Bassett,1948,Available under a Creative Commons Attribution 4.0 International (CC BY 4.0) license,image/tiff,en,StillImage
cbd_bel_ph_00,https://bassettassociates.s3.amazonaws.com/cbd/bel/cbd_bel_ph_00.jpg,"downtown,Bellefontaine",photo,3201x2112,Bellefontaine streetscape with pedestrians,,Bassett Associates,Bassett Associates files,James H. Bassett,,Available under a Creative Commons Attribution 4.0 International (CC BY 4.0) license,image/jpeg,,StillImage
cbd_bel_ph_01,https://bassettassociates.s3.amazonaws.com/cbd/bel/cbd_bel_ph_01.jpg,"downtown,Bellefontaine",photo,1998x3125,Planters in Bellefontaine streetscape,,Bassett Associates,Bassett Associates files,James H. Bassett,,Available under a Creative Commons Attribution 4.0 International (CC BY 4.0) license,image/jpeg,,StillImage
cbd_bel_ph_02,https://bassettassociates.s3.amazonaws.com/cbd/bel/cbd_bel_ph_02.jpg,"downtown,Bellefontaine,lighting",photo,2204x3148,Bellefontaine lamps at night,,Bassett Associates,Bassett Associates files,James H. Bassett,,Available under a Creative Commons Attribution 4.0 International (CC BY 4.0) license,image/jpeg,,StillImage
cbd_bel_ph_03,https://bassettassociates.s3.amazonaws.com/cbd/bel/cbd_bel_ph_03.jpg,"downtown,Bellefontaine,lighting",photo,2185x3110,Bellefontaine lamps during the day,,Bassett Associates,Bassett Associates files,James H. Bassett,,Available under a Creative Commons Attribution 4.0 International (CC BY 4.0) license,image/jpeg,,StillImage
cbd_bel_ph_04,https://bassettassociates.s3.amazonaws.com/cbd/bel/cbd_bel_ph_04.jpg,"downtown,Bellefontaine,fountain",photo,3239x2125,Fountain in Bellefontaine streetscape,,Bassett Associates,Bassett Associates files,James H. Bassett,,Available under a Creative Commons Attribution 4.0 International (CC BY 4.0) license,image/jpeg,,StillImage
cbd_bel_ph_05,https://bassettassociates.s3.amazonaws.com/cbd/bel/cbd_bel_ph_05.jpg,"downtown,Bellefontaine",photo,3150x2099,Pedestrian crossing in Bellefontaine streetscape,,Bassett Associates,Bassett Associates files,James H. Bassett,,Available under a Creative Commons Attribution 4.0 International (CC BY 4.0) license,image/jpeg,,StillImage
cbd_bel_ph_06,https://bassettassociates.s3.amazonaws.com/cbd/bel/cbd_bel_ph_06.jpg,"downtown,Bellefontaine",photo,2147x3148,Parking and planters in Bellefontaine streetscape,,Bassett Associates,Bassett Associates files,James H. Bassett,,Available under a Creative Commons Attribution 4.0 International (CC BY 4.0) license,image/jpeg,,StillImage
cbd_bel_ph_07,https://bassettassociates.s3.amazonaws.com/cbd/bel/cbd_bel_ph_07.jpg,"downtown,Bellefontaine",photo,3176x2125,Planters and pedestrian in Bellefontaine streetscape,,Bassett Associates,Bassett Associates files,James H. Bassett,,Available under a Creative Commons Attribution 4.0 International (CC BY 4.0) license,image/jpeg,,StillImage
cbd_bel_ph_08,https://bassettassociates.s3.amazonaws.com/cbd/bel/cbd_bel_ph_08.jpg,"downtown,Bellefontaine",photo,2147x3129,Planter and tree in Bellefontaine streetscape,,Bassett Associates,Bassett Associates files,James H. Bassett,,Available under a Creative Commons Attribution 4.0 International (CC BY 4.0) license,image/jpeg,,StillImage
cbd_bel_ph_09,https://bassettassociates.s3.amazonaws.com/cbd/bel/cbd_bel_ph_09.jpg,"downtown,Bellefontaine",photo,2222x3167,Storefront in Bellefontaine streetscape,,Bassett Associates,Bassett Associates files,James H. Bassett,,Available under a Creative Commons Attribution 4.0 International (CC BY 4.0) license,image/jpeg,,StillImage
cbd_bel_ph_10,https://bassettassociates.s3.amazonaws.com/cbd/bel/cbd_bel_ph_10.jpg,"downtown,Bellefontaine,seating",photo,2185x3167,Benches and brickwork in Bellefontaine streetscape,,Bassett Associates,Bassett Associates files,James H. Bassett,,Available under a Creative Commons Attribution 4.0 International (CC BY 4.0) license,image/jpeg,,StillImage
cbd_bel_ph_11,https://bassettassociates.s3.amazonaws.com/cbd/bel/cbd_bel_ph_11.jpg,"downtown,Bellefontaine",photo,3176x2112,"Trees, planters, and benches in Bellefontaine streetscape",,Bassett Associates,Bassett Associates files,James H. Bassett,,Available under a Creative Commons Attribution 4.0 International (CC BY 4.0) license,image/jpeg,,StillImage
cbd_bel_ph_12,https://bassettassociates.s3.amazonaws.com/cbd/bel/cbd_bel_ph_12.jpg,"downtown,Bellefontaine,construction",photo,2464x2354,Construction during Bellefontaine streetscape renovation,,Bassett Associates,Bassett Associates files,James H. Bassett,,Available under a Creative Commons Attribution 4.0 International (CC BY 4.0) license,image/jpeg,,StillImage
cbd_bel_ph_13,https://bassettassociates.s3.amazonaws.com/cbd/bel/cbd_bel_ph_13.jpg,"downtown,Bellefontaine,prior",photo,3163x2163,Traffic and courthouse prior to Bellefontaine streetscape renovataion,,Bassett Associates,Bassett Associates files,James H. Bassett,,Available under a Creative Commons Attribution 4.0 International (CC BY 4.0) license,image/jpeg,,StillImage
cbd_bel_ph_14,https://bassettassociates.s3.amazonaws.com/cbd/bel/cbd_bel_ph_14.jpg,"downtown,Bellefontaine,prior",photo,3125x2048,Traffic crossing prior to Bellefontaine streetscape renovation,,Bassett Associates,Bassett Associates files,James H. Bassett,,Available under a Creative Commons Attribution 4.0 International (CC BY 4.0) license,image/jpeg,,StillImage
cbd_bel_ph_15,https://bassettassociates.s3.amazonaws.com/cbd/bel/cbd_bel_ph_15.jpg,"downtown,Bellefontaine,prior",photo,2147x3129,Sidewalk and pedestrians prior to Bellefontaine streetscape renovation,,Bassett Associates,Bassett Associates files,James H. Bassett,,Available under a Creative Commons Attribution 4.0 International (CC BY 4.0) license,image/jpeg,,StillImage
cbd_bel_pl_00,https://bassettassociates.s3.amazonaws.com/cbd/bel/cbd_bel_pl_00.jpg,"downtown,Bellefontaine",plan,3176x2074,Bellefontaine courthouse plaza plan,,Bassett Associates,Bassett Associates files,James H. Bassett,,Available under a Creative Commons Attribution 4.0 International (CC BY 4.0) license,image/jpeg,en,StillImage
cbd_bel_pl_01,https://bassettassociates.s3.amazonaws.com/cbd/bel/cbd_bel_pl_01.jpg,"downtown,Bellefontaine,traffic",plan,2350x2150,Proposed parking for Bellefontaine Urban Design Plan,,Bassett Associates,Bassett Associates files,James H. Bassett,,Available under a Creative Commons Attribution 4.0 International (CC BY 4.0) license,image/jpeg,en,StillImage
cbd_bel_pl_02,https://bassettassociates.s3.amazonaws.com/cbd/bel/cbd_bel_pl_02.jpg,"downtown,Bellefontaine",plan,3176x2125,Bellefontaine courthouse plaza plan (detail),,Bassett Associates,Bassett Associates files,James H. Bassett,,Available under a Creative Commons Attribution 4.0 International (CC BY 4.0) license,image/jpeg,en,StillImage
cbd_bel_pl_03,https://bassettassociates.s3.amazonaws.com/cbd/bel/cbd_bel_pl_03.jpg,"downtown,Bellefontaine,traffic",plan,3074x2138,Proposed traffic circulation for Bellefontaine Urban Design Plan,,Bassett Associates,Bassett Associates files,James H. Bassett,,Available under a Creative Commons Attribution 4.0 International (CC BY 4.0) license,image/jpeg,en,StillImage
cbd_bel_sk_00,https://bassettassociates.s3.amazonaws.com/cbd/bel/cbd_bel_sk_00.jpg,"downtown,Bellefontaine",sketch,3188x2163,Bellefontaine streetscape sketch,,James H. Bassett,Bassett Associates files,James H. Bassett,,Available under a Creative Commons Attribution 4.0 International (CC BY 4.0) license,image/jpeg,,StillImage
cbd_bel_sk_01,https://bassettassociates.s3.amazonaws.com/cbd/bel/cbd_bel_sk_01.jpg,"downtown,Bellefontaine",sketch,3163x2163,Sketch of crossing and trees for Bellefontaine streetscape,,James H. Bassett,Bassett Associates files,James H. Bassett,,Available under a Creative Commons Attribution 4.0 International (CC BY 4.0) license,image/jpeg,,StillImage
cbd_bel_sk_02,https://bassettassociates.s3.amazonaws.com/cbd/bel/cbd_bel_sk_02.jpg,"downtown,Bellefontaine,fountain",sketch,3150x2087,Sketch of fountain in Bellefontaine courthouse plaza,,James H. Bassett,Bassett Associates files,James H. Bassett,,Available under a Creative Commons Attribution 4.0 International (CC BY 4.0) license,image/jpeg,,StillImage
cbd_bel_sk_03,https://bassettassociates.s3.amazonaws.com/cbd/bel/cbd_bel_sk_03.jpg,"downtown,Bellefontaine",sketch,2138x3150,Sketch of Bellefontaine courthouse with trees,,James H. Bassett,Bassett Associates files,James H. Bassett,,Available under a Creative Commons Attribution 4.0 International (CC BY 4.0) license,image/jpeg,,StillImage
cbd_bel_sk_04,https://bassettassociates.s3.amazonaws.com/cbd/bel/cbd_bel_sk_04.jpg,"downtown,Bellefontaine,section",sketch,3163x2112,"Cross section of street, parking, and sidewalk - Bellefontaine streetscape",,James H. Bassett,Bassett Associates files,James H. Bassett,,Available under a Creative Commons Attribution 4.0 International (CC BY 4.0) license,image/jpeg,en,StillImage
cbd_lim_1975_ph_00,https://bassettassociates.s3.amazonaws.com/cbd/lim/1975/cbd_lim_1975_ph_00.tif,"downtown,Lima,prior",photo,3588x2416,Historical photo of the Lima public square,,unknown,original source unknown,James H. Bassett,,Public Domain,image/tiff,,StillImage
cbd_lim_1975_ph_01,https://bassettassociates.s3.amazonaws.com/cbd/lim/1975/cbd_lim_1975_ph_01.tif,"downtown,Lima,prior",photo,3533x2403,Photo of the Lima public square prior to the Urban Design Plan,,Bassett Associates,Bassett Associates files,James H. Bassett,,Available under a Creative Commons Attribution 4.0 International (CC BY 4.0) license,image/tiff,,StillImage
cbd_lim_1975_ph_02,https://bassettassociates.s3.amazonaws.com/cbd/lim/1975/cbd_lim_1975_ph_02.tif,"downtown,Lima",photo,3539x2372,Photo of the Lima Town Square after implementation of the 1975 Urban Design Plan,,Bassett Associates,Bassett Associates files,James H. Bassett,,Available under a Creative Commons Attribution 4.0 International (CC BY 4.0) license,image/tiff,,StillImage
cbd_lim_1975_pl_00,https://bassettassociates.s3.amazonaws.com/cbd/lim/1975/cbd_lim_1975_pl_00.tif,"downtown,Lima,masterplan",plan,3062x2241,"Lima Urban Design Plan, 1975",,Bassett Associates,Bassett Associates files,James H. Bassett,1975,Available under a Creative Commons Attribution 4.0 International (CC BY 4.0) license,image/tiff,en,StillImage
cbd_lim_1975_sk_00,https://bassettassociates.s3.amazonaws.com/cbd/lim/1975/cbd_lim_1975_sk_00.tif,"downtown,Lima",sketch,3561x2416,View of the northwest part of the Lima Town Square,,James H. Bassett,Bassett Associates files,James H. Bassett,,Available under a Creative Commons Attribution 4.0 International (CC BY 4.0) license,image/tiff,en,StillImage
cbd_lim_1989_ph_00,https://bassettassociates.s3.amazonaws.com/cbd/lim/1989/cbd_lim_1989_ph_00.tif,"downtown,Lima,prior",photo,3506x2361,Historical photograph of the notheastern part of the Lima public square showing bandstand and streetcars,,unknown,original source unknown,James H. Bassett,,public domain,image/tiff,,StillImage
cbd_lim_1989_ph_01,https://bassettassociates.s3.amazonaws.com/cbd/lim/1989/cbd_lim_1989_ph_01.tif,"downtown,Lima",photo,3506x2361,"South west corner of the Lima Town Square, showing landscaping and the Civic Center",,Bassett Associates,Bassett Associates files,James H. Bassett,,Available under a Creative Commons Attribution 4.0 International (CC BY 4.0) license,image/tiff,,StillImage
cbd_lim_1989_ph_02,https://bassettassociates.s3.amazonaws.com/cbd/lim/1989/cbd_lim_1989_ph_02.tif,"downtown,Lima",photo,3506x2361,Pedestrians resting in the Lima Town Square,,Bassett Associates,Bassett Associates files,James H. Bassett,,Available under a Creative Commons Attribution 4.0 International (CC BY 4.0) license,image/tiff,,StillImage
cbd_lim_1989_pl_00,https://bassettassociates.s3.amazonaws.com/cbd/lim/1989/cbd_lim_1989_pl_00.tif,"downtown,Lima,masterplan",plan,2508x3214,"Lima, Ohio Central Business District Redevelopment Plan",,Bassett Associates,Bassett Associates files,James H. Bassett,,Available under a Creative Commons Attribution 4.0 International (CC BY 4.0) license,image/tiff,en,StillImage
cbd_lim_1994_ph_00,https://bassettassociates.s3.amazonaws.com/cbd/lim/1994/cbd_lim_1994_ph_00.jpg,"downtown,Lima",photo,2000x1500,Bicycle and pedestrian bridge across the Ottawa River,,Bassett Associates,Bassett Associates files,James H. Bassett,2008,Available under a Creative Commons Attribution 4.0 International (CC BY 4.0) license,image/jpeg,,StillImage
cbd_lim_1994_ph_01,https://bassettassociates.s3.amazonaws.com/cbd/lim/1994/cbd_lim_1994_ph_01.jpg,"downtown,Lima",photo,2000x1500,Bicycle and pedestrian bridge across the Ottawa River providing access to the Y.M.C.A.,,Bassett Associates,Bassett Associates files,James H. Bassett,,Available under a Creative Commons Attribution 4.0 International (CC BY 4.0) license,image/jpeg,,StillImage
cbd_lim_1994_pl_00,https://bassettassociates.s3.amazonaws.com/cbd/lim/1994/cbd_lim_1994_pl_00.jpg,"downtown,Lima,masterplan",plan,6144x4360,"Ottawa River Corridor Master Plan with pedestrian bridge and river cascades inset, 1994",,Bassett Associates,Bassett Associates files,James H. Bassett,,Available under a Creative Commons Attribution 4.0 International (CC BY 4.0) license,image/jpeg,en,StillImage
cbd_lim_1994_pl_01,https://bassettassociates.s3.amazonaws.com/cbd/lim/1994/cbd_lim_1994_pl_01.jpg,"downtown,Lima,masterplan",plan,2000x1500,"Ottawa River Corridor Master Plan, 1994",,Bassett Associates,Bassett Associates files,James H. Bassett,,Available under a Creative Commons Attribution 4.0 International (CC BY 4.0) license,image/jpeg,en,StillImage
cbd_lim_1994_sk_00,https://bassettassociates.s3.amazonaws.com/cbd/lim/1994/cbd_lim_1994_sk_00.tif,"downtown,Lima,artwork",sketch,3465x2320,Bicyclists on pedestrian bridge over the Ottawa River,,James H. Bassett,Bassett Associates files,James H. Bassett,,Available under a Creative Commons Attribution 4.0 International (CC BY 4.0) license,image/tiff,en,StillImage
cbd_lim_1994_sk_01,https://bassettassociates.s3.amazonaws.com/cbd/lim/1994/cbd_lim_1994_sk_01.tif,"downtown,Lima",sketch,3385x2035,Y.M.C.A. and Lima Memorial Hospital Fitness Center aerial view,,James H. Bassett,Bassett Associates files,James H. Bassett,,Available under a Creative Commons Attribution 4.0 International (CC BY 4.0) license,image/tiff,,StillImage
cbd_lim_1994_sk_02,https://bassettassociates.s3.amazonaws.com/cbd/lim/1994/cbd_lim_1994_sk_02.jpg,"downtown,Lima,artwork",sketch,2000x1500,Typical river walkway with pedestrians and bicyclist,,James H. Bassett,Bassett Associates files,James H. Bassett,,Available under a Creative Commons Attribution 4.0 International (CC BY 4.0) license,image/jpeg,en,StillImage
cbd_lim_2001_ph_00,https://bassettassociates.s3.amazonaws.com/cbd/lim/2001/cbd_lim_2001_ph_00.tif,"downtown,Lima,prior",photo,3561x2389,"Historical photo of the Mitchell Block and Waldo Hotel, northeast corner of the public square, Lima, Ohio",,unknown,original source unknown,James H. Bassett,,public domain,image/tiff,,StillImage
cbd_lim_2001_pl_00,https://bassettassociates.s3.amazonaws.com/cbd/lim/2001/cbd_lim_2001_pl_00.tif,"downtown,Lima,masterplan",plan,3505x2354,"Lima entry corridors and greenspace, 2001 Lima Central Business District Vision Plan",,Bassett Associates,Bassett Associates files,James H. Bassett,,Available under a Creative Commons Attribution 4.0 International (CC BY 4.0) license,image/tiff,en,StillImage
cbd_lim_2001_pl_01,https://bassettassociates.s3.amazonaws.com/cbd/lim/2001/cbd_lim_2001_pl_01.tif,"downtown,Lima,masterplan",plan,2430x3602,"Buildings and parking plan, 2001 Lima Central Business Vision Plan",,Bassett Associates,Bassett Associates files,James H. Bassett,,Available under a Creative Commons Attribution 4.0 International (CC BY 4.0) license,image/tiff,en,StillImage
cbd_lim_2001_sk_00,https://bassettassociates.s3.amazonaws.com/cbd/lim/2001/cbd_lim_2001_sk_00.tif,"downtown,Lima,artwork",sketch,3492x2320,"Boulevard concept, State Route 81 Corridor Study",,James H. Bassett,Bassett Associates files,James H. Bassett,,Available under a Creative Commons Attribution 4.0 International (CC BY 4.0) license,image/tiff,en,StillImage
cbd_lim_stritas_ph_00,https://bassettassociates.s3.amazonaws.com/cbd/lim/stritas/cbd_lim_stritas_ph_00.jpg,"downtown,Lima,fountain,storm water",photo,2000x1500,Fountain in storm water retention lake at St. Rita's Medical Center,,Bassett Associates,Bassett Associates files,James H. Bassett,,Available under a Creative Commons Attribution 4.0 International (CC BY 4.0) license,image/jpeg,,StillImage
cbd_lim_stritas_ph_01,https://bassettassociates.s3.amazonaws.com/cbd/lim/stritas/cbd_lim_stritas_ph_01.jpg,"downtown,Lima",photo,2000x1500,Aerial view of St. Rita's Medical Center entry courtyard,,Bassett Associates,Bassett Associates files,James H. Bassett,,Available under a Creative Commons Attribution 4.0 International (CC BY 4.0) license,image/jpeg,,StillImage
cbd_lim_stritas_ph_02,https://bassettassociates.s3.amazonaws.com/cbd/lim/stritas/cbd_lim_stritas_ph_02.jpg,"downtown,Lima,sign",photo,2000x1500,St. Rita's Medical Center entry sign and landscaping,,Bassett Associates,Bassett Associates files,James H. Bassett,,Available under a Creative Commons Attribution 4.0 International (CC BY 4.0) license,image/jpeg,en,StillImage
cbd_lim_stritas_ph_03,https://bassettassociates.s3.amazonaws.com/cbd/lim/stritas/cbd_lim_stritas_ph_03.jpg,"downtown,Lima",photo,2000x1500,Landscaped pathway with St. Rita's Medical Center in the background,,Bassett Associates,Bassett Associates files,James H. Bassett,,Available under a Creative Commons Attribution 4.0 International (CC BY 4.0) license,image/jpeg,,StillImage
cbd_lim_stritas_ph_04,https://bassettassociates.s3.amazonaws.com/cbd/lim/stritas/cbd_lim_stritas_ph_04.jpg,"downtown,Lima",photo,2000x1500,"Outdoor garden area, St. Rita's Medical Center",,Bassett Associates,Bassett Associates files,James H. Bassett,,Available under a Creative Commons Attribution 4.0 International (CC BY 4.0) license,image/jpeg,,StillImage
cbd_lim_stritas_ph_05,https://bassettassociates.s3.amazonaws.com/cbd/lim/stritas/cbd_lim_stritas_ph_05.jpg,"downtown,Lima",photo,2000x1500,"Multi-level walkways, St. Rita's Medical Center",,Bassett Associates,Bassett Associates files,James H. Bassett,,Available under a Creative Commons Attribution 4.0 International (CC BY 4.0) license,image/jpeg,,StillImage
cbd_lim_stritas_ph_06,https://bassettassociates.s3.amazonaws.com/cbd/lim/stritas/cbd_lim_stritas_ph_06.jpg,"downtown,Lima,storm water",photo,2000x1500,"Storm water retention lake with fountain and rainbow, St. Rita's Medical Center",,Bassett Associates,Bassett Associates files,James H. Bassett,,Available under a Creative Commons Attribution 4.0 International (CC BY 4.0) license,image/jpeg,,StillImage
cbd_lim_stritas_ph_07,https://bassettassociates.s3.amazonaws.com/cbd/lim/stritas/cbd_lim_stritas_ph_07.jpg,"downtown,Lima",photo,2000x1500,Landscaped water feature with St. Rita's Medical Center in the background,,Bassett Associates,Bassett Associates files,James H. Bassett,,Available under a Creative Commons Attribution 4.0 International (CC BY 4.0) license,image/jpeg,,StillImage
cbd_lim_stritas_ph_08,https://bassettassociates.s3.amazonaws.com/cbd/lim/stritas/cbd_lim_stritas_ph_08.jpg,"downtown,Lima",photo,2000x1500,Landscaped walkway adjacent to lake at St. Rita's Medical Center,,Bassett Associates,Bassett Associates files,James H. Bassett,,Available under a Creative Commons Attribution 4.0 International (CC BY 4.0) license,image/jpeg,,StillImage
cbd_lim_stritas_ph_09,https://bassettassociates.s3.amazonaws.com/cbd/lim/stritas/cbd_lim_stritas_ph_09.jpg,"downtown,Lima",photo,2000x1500,Trees and shrubs in bloom at entrance to St. Rita's Medical Center,,Bassett Associates,Bassett Associates files,James H. Bassett,,Available under a Creative Commons Attribution 4.0 International (CC BY 4.0) license,image/jpeg,en,StillImage
cbd_lim_stritas_pl_00,https://bassettassociates.s3.amazonaws.com/cbd/lim/stritas/cbd_lim_stritas_pl_00.jpg,"downtown,Lima",plan,2000x1500,Site plan for St. Rita's Medical Center,,Bassett Associates,Bassett Associates files,James H. Bassett,,Available under a Creative Commons Attribution 4.0 International (CC BY 4.0) license,image/jpeg,en,StillImage
cbd_man_ph_00,https://bassettassociates.s3.amazonaws.com/cbd/man/cbd_man_ph_00.jpg,"downtown,Mansfield,seating,fountain",photo,3000x2000,People seated at tables in a landscaped plaza,,Bassett Associates,Bassett Associates files,James H. Bassett,,Available under a Creative Commons Attribution 4.0 International (CC BY 4.0) license,image/jpeg,,StillImage
cbd_man_ph_01,https://bassettassociates.s3.amazonaws.com/cbd/man/cbd_man_ph_01.jpg,"downtown,Mansfield",photo,3000x2000,Flower bed and trees with seated people and pedestrians behind,,Bassett Associates,Bassett Associates files,James H. Bassett,,Available under a Creative Commons Attribution 4.0 International (CC BY 4.0) license,image/jpeg,,StillImage
cbd_man_ph_02,https://bassettassociates.s3.amazonaws.com/cbd/man/cbd_man_ph_02.jpg,"downtown,Mansfield",photo,3000x2000,Large planter with grid of trees and seated people,,Bassett Associates,Bassett Associates files,James H. Bassett,,Available under a Creative Commons Attribution 4.0 International (CC BY 4.0) license,image/jpeg,,StillImage
cbd_man_ph_03,https://bassettassociates.s3.amazonaws.com/cbd/man/cbd_man_ph_03.jpg,"downtown,Mansfield",photo,3000x2000,Children's play structure,,Bassett Associates,Bassett Associates files,James H. Bassett,,Available under a Creative Commons Attribution 4.0 International (CC BY 4.0) license,image/jpeg,,StillImage
cbd_man_ph_04,https://bassettassociates.s3.amazonaws.com/cbd/man/cbd_man_ph_04.jpg,"downtown,Mansfield",photo,3000x2000,Street crossing with landscaping,,Bassett Associates,Bassett Associates files,James H. Bassett,,Available under a Creative Commons Attribution 4.0 International (CC BY 4.0) license,image/jpeg,,StillImage
cbd_man_ph_05,https://bassettassociates.s3.amazonaws.com/cbd/man/cbd_man_ph_05.jpg,"downtown,Mansfield,construction",photo,3000x2000,Paving street with decorative bricks,,Bassett Associates,Bassett Associates files,James H. Bassett,,Available under a Creative Commons Attribution 4.0 International (CC BY 4.0) license,image/jpeg,,StillImage
cbd_man_ph_06,https://bassettassociates.s3.amazonaws.com/cbd/man/cbd_man_ph_06.jpg,"downtown,Mansfield,construction",photo,3000x2000,Pouring concrete for curbs,,Bassett Associates,Bassett Associates files,James H. Bassett,,Available under a Creative Commons Attribution 4.0 International (CC BY 4.0) license,image/jpeg,,StillImage
cbd_man_ph_07,https://bassettassociates.s3.amazonaws.com/cbd/man/cbd_man_ph_07.jpg,"downtown,Mansfield,prior",photo,3000x2000,Interesection and automobile traffic,,Bassett Associates,Bassett Associates files,James H. Bassett,,Available under a Creative Commons Attribution 4.0 International (CC BY 4.0) license,image/jpeg,,StillImage
cbd_man_ph_08,https://bassettassociates.s3.amazonaws.com/cbd/man/cbd_man_ph_08.jpg,"downtown,Mansfield,prior",photo,3000x2000,Sidewalk and storefronts,,Bassett Associates,Bassett Associates files,James H. Bassett,,Available under a Creative Commons Attribution 4.0 International (CC BY 4.0) license,image/jpeg,,StillImage
cbd_man_ph_09,https://bassettassociates.s3.amazonaws.com/cbd/man/cbd_man_ph_09.jpg,"downtown,Mansfield,prior",photo,3000x2000,Pedestrian crossing,,Bassett Associates,Bassett Associates files,James H. Bassett,,Available under a Creative Commons Attribution 4.0 International (CC BY 4.0) license,image/jpeg,,StillImage
cbd_man_pl_00,https://bassettassociates.s3.amazonaws.com/cbd/man/cbd_man_pl_00.jpg,"downtown,Mansfield,masterplan",plan,2144x3112,Mansfield Development Program master plan,,Bassett Associates,Bassett Associates files,James H. Bassett,,Available under a Creative Commons Attribution 4.0 International (CC BY 4.0) license,image/jpeg,en,StillImage
cbd_man_pl_01,https://bassettassociates.s3.amazonaws.com/cbd/man/cbd_man_pl_01.jpg,"downtown,Mansfield",plan,2208x3128,"Streetscape concept, Mansfield Development Program",,Bassett Associates,Bassett Associates files,James H. Bassett,,Available under a Creative Commons Attribution 4.0 International (CC BY 4.0) license,image/jpeg,en,StillImage
cbd_man_pl_02,https://bassettassociates.s3.amazonaws.com/cbd/man/cbd_man_pl_02.jpg,"downtown,Mansfield",plan,3000x2000,"Existing land use map, Mansfield, Ohio",,Bassett Associates,Bassett Associates files,James H. Bassett,,Available under a Creative Commons Attribution 4.0 International (CC BY 4.0) license,image/jpeg,en,StillImage
cbd_man_sk_00,https://bassettassociates.s3.amazonaws.com/cbd/man/cbd_man_sk_00.jpg,"downtown,Mansfield,map",sketch,1718x825,Park Avenue Office World storefront,,James H. Bassett,Bassett Associates files,James H. Bassett,,Available under a Creative Commons Attribution 4.0 International (CC BY 4.0) license,image/jpeg,en,StillImage
