Dublin Core:Identifier,upload_url,tags,Item Type Metadata:Original Format,Item Type Metadata:Physical Dimensions,Dublin Core:Title,Dublin Core:Description,Dublin Core:Creator,Dublin Core:Source,Dublin Core:Publisher,Dublin Core:Date,Dublin Core:Rights,Dublin Core:Format,Dublin Core:Language,Dublin Core:Type
zoo_col_ph_06,https://bassettassociates.s3.amazonaws.com/zoo/col/zoo_col_ph_06.tif,"zoo,Columbus",photo,2956x1957,Landscaping and elevated path through exhibit,,Bassett Associates,Bassett Associates files,James H. Bassett,,Available under a Creative Commons Attribution 4.0 International (CC BY 4.0) license,image/tiff,,StillImage
zoo_col_ph_07,https://bassettassociates.s3.amazonaws.com/zoo/col/zoo_col_ph_07.jpg,"zoo,Columbus,animal",photo,3240x2224,Bonobos,,Bassett Associates,Bassett Associates files,James H. Bassett,,Available under a Creative Commons Attribution 4.0 International (CC BY 4.0) license,image/jpeg,,StillImage
zoo_col_ph_08,https://bassettassociates.s3.amazonaws.com/zoo/col/zoo_col_ph_08.jpg,"zoo,Columbus",photo,3160x2128,Visitors looking at an exhibit through glass from a shaded shelter,,Bassett Associates,Bassett Associates files,James H. Bassett,,Available under a Creative Commons Attribution 4.0 International (CC BY 4.0) license,image/jpeg,,StillImage
zoo_col_ph_09,https://bassettassociates.s3.amazonaws.com/zoo/col/zoo_col_ph_09.jpg,"zoo,Columbus,sign",photo,3328x2312,Interpretive signs for wetlands exhibit,,Bassett Associates,Bassett Associates files,James H. Bassett,,Available under a Creative Commons Attribution 4.0 International (CC BY 4.0) license,image/jpeg,,StillImage
zoo_col_ph_10,https://bassettassociates.s3.amazonaws.com/zoo/col/zoo_col_ph_10.jpg,"zoo,Columbus",photo,2248x3304,Children view above and below water surface of wetlands exhibit,,Bassett Associates,Bassett Associates files,James H. Bassett,,Available under a Creative Commons Attribution 4.0 International (CC BY 4.0) license,image/jpeg,,StillImage
zoo_col_ph_11,https://bassettassociates.s3.amazonaws.com/zoo/col/zoo_col_ph_11.jpg,"zoo,Columbus",photo,3216x2280,Visitors walking through an aviary,,Bassett Associates,Bassett Associates files,James H. Bassett,,Available under a Creative Commons Attribution 4.0 International (CC BY 4.0) license,image/jpeg,,StillImage
zoo_col_pl_00,https://bassettassociates.s3.amazonaws.com/zoo/col/zoo_col_pl_00.jpg,"zoo,Columbus",plan,3184x2136,Columbus Zoo African Forest concept plan,,Bassett Associates,Bassett Associates files,James H. Bassett,,Available under a Creative Commons Attribution 4.0 International (CC BY 4.0) license,image/jpeg,en,StillImage
zoo_col_pl_01,https://bassettassociates.s3.amazonaws.com/zoo/col/zoo_col_pl_01.tif,"zoo,Columbus",plan,2933x1945,Bonobo exhibit plan detail,,James H. Bassett,Bassett Associates files,James H. Bassett,,Available under a Creative Commons Attribution 4.0 International (CC BY 4.0) license,image/tiff,en,StillImage
zoo_col_sk_00,https://bassettassociates.s3.amazonaws.com/zoo/col/zoo_col_sk_00.tif,"zoo,Columbus,section",sketch,2882x1273,West elevation view of entry to West Africa exhibit,,James H. Bassett,Bassett Associates files,James H. Bassett,,Available under a Creative Commons Attribution 4.0 International (CC BY 4.0) license,image/tiff,en,StillImage
zoo_col_sk_01,https://bassettassociates.s3.amazonaws.com/zoo/col/zoo_col_sk_01.tif,"zoo,Columbus,section",sketch,2444x700,Forest entry cross section showing interpretive center and food court,,James H. Bassett,Bassett Associates files,James H. Bassett,,Available under a Creative Commons Attribution 4.0 International (CC BY 4.0) license,image/tiff,en,StillImage
zoo_col_sk_02,https://bassettassociates.s3.amazonaws.com/zoo/col/zoo_col_sk_02.tif,"zoo,Columbus,section",sketch,1891x979,Aviary and colobus exhibit section,,James H. Bassett,Bassett Associates files,James H. Bassett,,Available under a Creative Commons Attribution 4.0 International (CC BY 4.0) license,image/tiff,en,StillImage
zoo_col_sk_03,https://bassettassociates.s3.amazonaws.com/zoo/col/zoo_col_sk_03.tif,"zoo,Columbus,section",sketch,2922x1625,Forest entry cross section (detail),,James H. Bassett,Bassett Associates files,James H. Bassett,,Available under a Creative Commons Attribution 4.0 International (CC BY 4.0) license,image/tiff,en,StillImage
zoo_col_sk_05,https://bassettassociates.s3.amazonaws.com/zoo/col/zoo_col_sk_05.tif,"zoo,Columbus,artwork",sketch,4000x2750,Okapi,,James H. Bassett,Bassett Associates files,James H. Bassett,,Available under a Creative Commons Attribution 4.0 International (CC BY 4.0) license,image/tiff,,StillImage
zoo_col_sk_06,https://bassettassociates.s3.amazonaws.com/zoo/col/zoo_col_sk_06.jpg,"zoo,Columbus,section",sketch,3218x1498,Gorilla exhibit cross section,,James H. Bassett,Bassett Associates files,James H. Bassett,,Available under a Creative Commons Attribution 4.0 International (CC BY 4.0) license,image/jpeg,en,StillImage
zoo_eri_ph_00,https://bassettassociates.s3.amazonaws.com/zoo/eri/zoo_eri_ph_00.jpg,"zoo,Erie",photo,213x160,Historical photo of a dugout cabin,,unknown,original source unknown,James H. Bassett,,public domain,image/jpeg,,StillImage
zoo_eri_ph_01,https://bassettassociates.s3.amazonaws.com/zoo/eri/zoo_eri_ph_01.tif,"zoo,Erie,animal",photo,2250x1500,Prairie dog with flowers in the foreground,,Bassett Associates,Bassett Associates files,James H. Bassett,,Available under a Creative Commons Attribution 4.0 International (CC BY 4.0) license,image/tiff,,StillImage
zoo_eri_ph_02,https://bassettassociates.s3.amazonaws.com/zoo/eri/zoo_eri_ph_02.tif,"zoo,Erie,animal",photo,2356x1593,Penguins swimming in their exhibit,,Bassett Associates,Bassett Associates files,James H. Bassett,,Available under a Creative Commons Attribution 4.0 International (CC BY 4.0) license,image/tiff,,StillImage
zoo_eri_ph_03,https://bassettassociates.s3.amazonaws.com/zoo/eri/zoo_eri_ph_03.tif,"zoo,Erie,animal",photo,2356x1565,Children petting goats,,Bassett Associates,Bassett Associates files,James H. Bassett,,Available under a Creative Commons Attribution 4.0 International (CC BY 4.0) license,image/tiff,,StillImage
zoo_eri_pl_00,https://bassettassociates.s3.amazonaws.com/zoo/eri/zoo_eri_pl_00.tif,"zoo,Erie",plan,1684x1429,Plan detail from Australian exhibit,,Bassett Associates,Bassett Associates files,James H. Bassett,,Available under a Creative Commons Attribution 4.0 International (CC BY 4.0) license,image/tiff,,StillImage
zoo_eri_pl_01,https://bassettassociates.s3.amazonaws.com/zoo/eri/zoo_eri_pl_01.tif,"zoo,Erie",plan,1641x810,Plan detail of garden,,Bassett Associates,Bassett Associates files,James H. Bassett,,Available under a Creative Commons Attribution 4.0 International (CC BY 4.0) license,image/tiff,,StillImage
zoo_eri_pl_02,https://bassettassociates.s3.amazonaws.com/zoo/eri/zoo_eri_pl_02.tif,"zoo,Erie",plan,5040x2823,Plan of entire project,,Bassett Associates,Bassett Associates files,James H. Bassett,,Available under a Creative Commons Attribution 4.0 International (CC BY 4.0) license,image/tiff,en,StillImage
zoo_eri_pl_03,https://bassettassociates.s3.amazonaws.com/zoo/eri/zoo_eri_pl_03.tif,"zoo,Erie",plan,2383x1583,Plan of entire zoo,,Bassett Associates,Bassett Associates files,James H. Bassett,,Available under a Creative Commons Attribution 4.0 International (CC BY 4.0) license,image/tiff,en,StillImage
zoo_eri_sk_00,https://bassettassociates.s3.amazonaws.com/zoo/eri/zoo_eri_sk_00.tif,"zoo,Erie,artwork",sketch,3404x2544,Kangaroo exhibit,,James H. Bassett,Bassett Associates files,James H. Bassett,,Available under a Creative Commons Attribution 4.0 International (CC BY 4.0) license,image/tiff,,StillImage
zoo_eri_sk_01,https://bassettassociates.s3.amazonaws.com/zoo/eri/zoo_eri_sk_01.tif,"zoo,Erie,artwork",sketch,3746x2878,Oblique aerial view of entry,,James H. Bassett,Bassett Associates files,James H. Bassett,,Available under a Creative Commons Attribution 4.0 International (CC BY 4.0) license,image/tiff,,StillImage
zoo_eri_sk_02,https://bassettassociates.s3.amazonaws.com/zoo/eri/zoo_eri_sk_02.tif,"zoo,Erie,section",sketch,5000x2419,Penguin exhibit,,James H. Bassett,Bassett Associates files,James H. Bassett,,Available under a Creative Commons Attribution 4.0 International (CC BY 4.0) license,image/tiff,,StillImage
zoo_eri_sk_03,https://bassettassociates.s3.amazonaws.com/zoo/eri/zoo_eri_sk_03.tif,"zoo,Erie,section",sketch,4519x2271,Prairie dog exhibit,,James H. Bassett,Bassett Associates files,James H. Bassett,,Available under a Creative Commons Attribution 4.0 International (CC BY 4.0) license,image/tiff,,StillImage
zoo_ftw_aust_ph_00,https://bassettassociates.s3.amazonaws.com/zoo/ftw/aust/zoo_ftw_aust_ph_00.tif,"zoo,Fort Wayne,sign",photo,2324x3519,"Entrance gateway to Australian Adventure, Fort Wayne Zoo",,Bassett Associates,Bassett Associates files,James H. Bassett,,Available under a Creative Commons Attribution 4.0 International (CC BY 4.0) license,image/tiff,en,StillImage
zoo_ftw_aust_ph_01,https://bassettassociates.s3.amazonaws.com/zoo/ftw/aust/zoo_ftw_aust_ph_01.jpg,"zoo,Fort Wayne,animal",photo,3128x2120,Kangaroos with guests in boat behind,,Bassett Associates,Bassett Associates files,James H. Bassett,,Available under a Creative Commons Attribution 4.0 International (CC BY 4.0) license,image/jpeg,,StillImage
zoo_ftw_aust_ph_02,https://bassettassociates.s3.amazonaws.com/zoo/ftw/aust/zoo_ftw_aust_ph_02.jpg,"zoo,Fort Wayne,animal",photo,3128x2152,Kangaroo grazing,,Bassett Associates,Bassett Associates files,James H. Bassett,,Available under a Creative Commons Attribution 4.0 International (CC BY 4.0) license,image/jpeg,,StillImage
zoo_ftw_aust_ph_03,https://bassettassociates.s3.amazonaws.com/zoo/ftw/aust/zoo_ftw_aust_ph_03.jpg,"zoo,Fort Wayne,sign",photo,2088x3256,Distances sign and flowerbed,,Bassett Associates,Bassett Associates files,James H. Bassett,,Available under a Creative Commons Attribution 4.0 International (CC BY 4.0) license,image/jpeg,en,StillImage
zoo_ftw_aust_ph_04,https://bassettassociates.s3.amazonaws.com/zoo/ftw/aust/zoo_ftw_aust_ph_04.jpg,"zoo,Fort Wayne",photo,2168x3264,Visitors entering Australian Adventure gateway,,Bassett Associates,Bassett Associates files,James H. Bassett,,Available under a Creative Commons Attribution 4.0 International (CC BY 4.0) license,image/jpeg,,StillImage
zoo_ftw_aust_ph_05,https://bassettassociates.s3.amazonaws.com/zoo/ftw/aust/zoo_ftw_aust_ph_05.jpg,"zoo,Fort Wayne",photo,3120x2144,Visitors outside concessions building,,Bassett Associates,Bassett Associates files,James H. Bassett,,Available under a Creative Commons Attribution 4.0 International (CC BY 4.0) license,image/jpeg,,StillImage
zoo_ftw_aust_ph_06,https://bassettassociates.s3.amazonaws.com/zoo/ftw/aust/zoo_ftw_aust_ph_06.jpg,"zoo,Fort Wayne",photo,3176x2176,Visitors riding in a boat shaped like a log,,Bassett Associates,Bassett Associates files,James H. Bassett,,Available under a Creative Commons Attribution 4.0 International (CC BY 4.0) license,image/jpeg,,StillImage
zoo_ftw_aust_ph_07,https://bassettassociates.s3.amazonaws.com/zoo/ftw/aust/zoo_ftw_aust_ph_07.jpg,"zoo,Fort Wayne",photo,3288x2224,Dirt pathway through plantings between Australian Adventure exhibits,,Bassett Associates,Bassett Associates files,James H. Bassett,,Available under a Creative Commons Attribution 4.0 International (CC BY 4.0) license,image/jpeg,,StillImage
zoo_ftw_aust_ph_08,https://bassettassociates.s3.amazonaws.com/zoo/ftw/aust/zoo_ftw_aust_ph_08.jpg,"zoo,Fort Wayne,animal",photo,3096x2144,Kangaroos resting in shade with outback building in background,,Bassett Associates,Bassett Associates files,James H. Bassett,,Available under a Creative Commons Attribution 4.0 International (CC BY 4.0) license,image/jpeg,,StillImage
zoo_ftw_aust_ph_09,https://bassettassociates.s3.amazonaws.com/zoo/ftw/aust/zoo_ftw_aust_ph_09.jpg,"zoo,Fort Wayne",photo,3096x2152,Concessions building with distances sign and visitors,,Bassett Associates,Bassett Associates files,James H. Bassett,,Available under a Creative Commons Attribution 4.0 International (CC BY 4.0) license,image/jpeg,,StillImage
zoo_ftw_aust_ph_10,https://bassettassociates.s3.amazonaws.com/zoo/ftw/aust/zoo_ftw_aust_ph_10.jpg,"zoo,Fort Wayne,construction",photo,3152x2256,View of construction of exhibit foundations,,Bassett Associates,Bassett Associates files,James H. Bassett,,Available under a Creative Commons Attribution 4.0 International (CC BY 4.0) license,image/jpeg,,StillImage
zoo_ftw_aust_ph_11,https://bassettassociates.s3.amazonaws.com/zoo/ftw/aust/zoo_ftw_aust_ph_11.jpg,"zoo,Fort Wayne,fountain",photo,3128x2176,Visitors resting in a plaza near a fountain,,Bassett Associates,Bassett Associates files,James H. Bassett,,Available under a Creative Commons Attribution 4.0 International (CC BY 4.0) license,image/jpeg,,StillImage
zoo_ftw_aust_ph_12,https://bassettassociates.s3.amazonaws.com/zoo/ftw/aust/zoo_ftw_aust_ph_12.jpg,"zoo,Fort Wayne",photo,3128x2144,Visitors walking through an aviary,,Bassett Associates,Bassett Associates files,James H. Bassett,,Available under a Creative Commons Attribution 4.0 International (CC BY 4.0) license,image/jpeg,,StillImage
zoo_ftw_aust_ph_13,https://bassettassociates.s3.amazonaws.com/zoo/ftw/aust/zoo_ftw_aust_ph_13.jpg,"zoo,Fort Wayne,animal",photo,3120x2120,Tasmanian devil,,Bassett Associates,Bassett Associates files,James H. Bassett,,Available under a Creative Commons Attribution 4.0 International (CC BY 4.0) license,image/jpeg,,StillImage
zoo_ftw_aust_ph_14,https://bassettassociates.s3.amazonaws.com/zoo/ftw/aust/zoo_ftw_aust_ph_14.jpg,"zoo,Fort Wayne",photo,3096x2176,Interpretive display with visitors walking in background,,Bassett Associates,Bassett Associates files,James H. Bassett,,Available under a Creative Commons Attribution 4.0 International (CC BY 4.0) license,image/jpeg,,StillImage
zoo_ftw_aust_ph_15,https://bassettassociates.s3.amazonaws.com/zoo/ftw/aust/zoo_ftw_aust_ph_15.jpg,"zoo,Fort Wayne",photo,3152x2144,Visitors with children in strollers walking through landscaped plaza,,Bassett Associates,Bassett Associates files,James H. Bassett,,Available under a Creative Commons Attribution 4.0 International (CC BY 4.0) license,image/jpeg,,StillImage
zoo_ftw_aust_ph_16,https://bassettassociates.s3.amazonaws.com/zoo/ftw/aust/zoo_ftw_aust_ph_16.jpg,"zoo,Fort Wayne,construction",photo,3184x2176,Construction of waterway,,Bassett Associates,Bassett Associates files,James H. Bassett,,Available under a Creative Commons Attribution 4.0 International (CC BY 4.0) license,image/jpeg,,StillImage
zoo_ftw_aust_ph_17,https://bassettassociates.s3.amazonaws.com/zoo/ftw/aust/zoo_ftw_aust_ph_17.jpg,"zoo,Fort Wayne,animal",photo,2088x3176,Children viewing birds in an aviary,,Bassett Associates,Bassett Associates files,James H. Bassett,,Available under a Creative Commons Attribution 4.0 International (CC BY 4.0) license,image/jpeg,,StillImage
zoo_ftw_aust_ph_18,https://bassettassociates.s3.amazonaws.com/zoo/ftw/aust/zoo_ftw_aust_ph_18.jpg,"zoo,Fort Wayne,animal",photo,3176x2152,Emus and kangaroos resting with visitors passing by,,Bassett Associates,Bassett Associates files,James H. Bassett,,Available under a Creative Commons Attribution 4.0 International (CC BY 4.0) license,image/jpeg,,StillImage
zoo_ftw_aust_ph_19,https://bassettassociates.s3.amazonaws.com/zoo/ftw/aust/zoo_ftw_aust_ph_19.jpg,"zoo,Fort Wayne",photo,3128x2144,Trees in planters with distances sign and visitors in the background,,Bassett Associates,Bassett Associates files,James H. Bassett,,Available under a Creative Commons Attribution 4.0 International (CC BY 4.0) license,image/jpeg,,StillImage
zoo_ftw_aust_ph_20,https://bassettassociates.s3.amazonaws.com/zoo/ftw/aust/zoo_ftw_aust_ph_20.jpg,"zoo,Fort Wayne",photo,2064x3216,Visitors eating and talking,,Bassett Associates,Bassett Associates files,James H. Bassett,,Available under a Creative Commons Attribution 4.0 International (CC BY 4.0) license,image/jpeg,,StillImage
zoo_ftw_aust_ph_21,https://bassettassociates.s3.amazonaws.com/zoo/ftw/aust/zoo_ftw_aust_ph_21.jpg,"zoo,Fort Wayne,animal",photo,3128x2168,Visitors viewing fish in a wall-sized aquarium,,Bassett Associates,Bassett Associates files,James H. Bassett,,Available under a Creative Commons Attribution 4.0 International (CC BY 4.0) license,image/jpeg,,StillImage
zoo_ftw_aust_ph_22,https://bassettassociates.s3.amazonaws.com/zoo/ftw/aust/zoo_ftw_aust_ph_22.jpg,"zoo,Fort Wayne,animal",photo,2064x3176,Bat flying in a simulated cave exhibit,,Bassett Associates,Bassett Associates files,James H. Bassett,,Available under a Creative Commons Attribution 4.0 International (CC BY 4.0) license,image/jpeg,,StillImage
zoo_ftw_aust_ph_23,https://bassettassociates.s3.amazonaws.com/zoo/ftw/aust/zoo_ftw_aust_ph_23.jpg,"zoo,Fort Wayne",photo,3120x2120,Landscaping and visitors on walkways,,Bassett Associates,Bassett Associates files,James H. Bassett,,Available under a Creative Commons Attribution 4.0 International (CC BY 4.0) license,image/jpeg,,StillImage
zoo_ftw_aust_ph_24,https://bassettassociates.s3.amazonaws.com/zoo/ftw/aust/zoo_ftw_aust_ph_24.jpg,"zoo,Fort Wayne,animal",photo,3344x2544,Visitors viewing an emu,,Bassett Associates,Bassett Associates files,James H. Bassett,,Available under a Creative Commons Attribution 4.0 International (CC BY 4.0) license,image/jpeg,,StillImage
zoo_ftw_aust_ph_25,https://bassettassociates.s3.amazonaws.com/zoo/ftw/aust/zoo_ftw_aust_ph_25.jpg,"zoo,Fort Wayne",photo,3232x2232,Visitors riding in a log-shaped boat photographing swans,,Bassett Associates,Bassett Associates files,James H. Bassett,,Available under a Creative Commons Attribution 4.0 International (CC BY 4.0) license,image/jpeg,,StillImage
zoo_ftw_aust_ph_26,https://bassettassociates.s3.amazonaws.com/zoo/ftw/aust/zoo_ftw_aust_ph_26.jpg,"zoo,Fort Wayne,animal",photo,3176x2256,Dingos resting,,Bassett Associates,Bassett Associates files,James H. Bassett,,Available under a Creative Commons Attribution 4.0 International (CC BY 4.0) license,image/jpeg,,StillImage
zoo_ftw_aust_ph_27,https://bassettassociates.s3.amazonaws.com/zoo/ftw/aust/zoo_ftw_aust_ph_27.jpg,"zoo,Fort Wayne",photo,3232x2256,Visitors looking at an exhibit under a shade structure,,Bassett Associates,Bassett Associates files,James H. Bassett,,Available under a Creative Commons Attribution 4.0 International (CC BY 4.0) license,image/jpeg,,StillImage
zoo_ftw_aust_pl_00,https://bassettassociates.s3.amazonaws.com/zoo/ftw/aust/zoo_ftw_aust_pl_00.jpg,"zoo,Fort Wayne,masterplan,section",plan,3152x2176,"Plan for Australian Adventure, Fort Wayne Zoo, including inset cross section",,Bassett Associates,Bassett Associates files,James H. Bassett,,Available under a Creative Commons Attribution 4.0 International (CC BY 4.0) license,image/jpeg,en,StillImage
zoo_ftw_aust_pl_01,https://bassettassociates.s3.amazonaws.com/zoo/ftw/aust/zoo_ftw_aust_pl_01.jpg,"zoo,Fort Wayne",plan,2876x1843,Courtyard plantings and location of Great Barrier Reef building and Tasmanian Devil exhibit,,Bassett Associates,Bassett Associates files,James H. Bassett,,Available under a Creative Commons Attribution 4.0 International (CC BY 4.0) license,image/jpeg,en,StillImage
zoo_ftw_aust_pl_02,https://bassettassociates.s3.amazonaws.com/zoo/ftw/aust/zoo_ftw_aust_pl_02.jpg,"zoo,Fort Wayne",plan,2894x2151,Closeup of Outback portion of Australian Exhibit plan,,Bassett Associates,Bassett Associates files,James H. Bassett,,Available under a Creative Commons Attribution 4.0 International (CC BY 4.0) license,image/jpeg,en,StillImage
zoo_ftw_aust_pl_03,https://bassettassociates.s3.amazonaws.com/zoo/ftw/aust/zoo_ftw_aust_pl_03.jpg,"zoo,Fort Wayne",plan,3176x2280,"Floor plan for bat, bandicoot, tree kangaroo, and rock wallaby exhibit building",,Bassett Associates,Bassett Associates files,James H. Bassett,,Available under a Creative Commons Attribution 4.0 International (CC BY 4.0) license,image/jpeg,en,StillImage
zoo_ftw_aust_pl_04,https://bassettassociates.s3.amazonaws.com/zoo/ftw/aust/zoo_ftw_aust_pl_04.jpg,"zoo,Fort Wayne",plan,3184x2146,"Plan of Australia Exhibit, Fort Wayne Zoo",,Bassett Associates,Bassett Associates files,James H. Bassett,,Available under a Creative Commons Attribution 4.0 International (CC BY 4.0) license,image/jpeg,en,StillImage
zoo_ftw_aust_sk_00,https://bassettassociates.s3.amazonaws.com/zoo/ftw/aust/zoo_ftw_aust_sk_00.jpg,"zoo,Fort Wayne,artwork",sketch,3264x2144,Visitors riding in a boat viewing kangaroos and water birds,,James H. Bassett,Bassett Associates files,James H. Bassett,,Available under a Creative Commons Attribution 4.0 International (CC BY 4.0) license,image/jpeg,,StillImage
zoo_ftw_aust_sk_01,https://bassettassociates.s3.amazonaws.com/zoo/ftw/aust/zoo_ftw_aust_sk_01.jpg,"zoo,Fort Wayne,section",sketch,1158x814,Section of river ride and exhibit,,James H. Bassett,Bassett Associates files,James H. Bassett,,Available under a Creative Commons Attribution 4.0 International (CC BY 4.0) license,image/jpeg,en,StillImage
zoo_ftw_aust_sk_02,https://bassettassociates.s3.amazonaws.com/zoo/ftw/aust/zoo_ftw_aust_sk_02.jpg,"zoo,Fort Wayne,artwork",sketch,3037x1045,Great Barrier Reef wall aquarium with visitors,,James H. Bassett,Bassett Associates files,James H. Bassett,,Available under a Creative Commons Attribution 4.0 International (CC BY 4.0) license,image/jpeg,en,StillImage
zoo_ftw_indo_ph_00,https://bassettassociates.s3.amazonaws.com/zoo/ftw/indo/zoo_ftw_indo_ph_00.tif,"zoo,Fort Wayne,animal",photo,3478x2307,Orangutan sitting on branch,,Bassett Associates,Bassett Associates files,James H. Bassett,,Available under a Creative Commons Attribution 4.0 International (CC BY 4.0) license,image/tiff,,StillImage
zoo_ftw_indo_ph_01,https://bassettassociates.s3.amazonaws.com/zoo/ftw/indo/zoo_ftw_indo_ph_01.tif,"zoo,Fort Wayne",photo,1002x1431,Butterfly on flower,,Bassett Associates,Bassett Associates files,James H. Bassett,,Available under a Creative Commons Attribution 4.0 International (CC BY 4.0) license,image/tiff,,StillImage
zoo_ftw_indo_ph_02,https://bassettassociates.s3.amazonaws.com/zoo/ftw/indo/zoo_ftw_indo_ph_02.tif,"zoo,Fort Wayne",photo,2250x1500,Children riding on endangered species carousel,,Bassett Associates,Bassett Associates files,James H. Bassett,,Available under a Creative Commons Attribution 4.0 International (CC BY 4.0) license,image/tiff,,StillImage
zoo_ftw_indo_ph_03,https://bassettassociates.s3.amazonaws.com/zoo/ftw/indo/zoo_ftw_indo_ph_03.tif,"zoo,Fort Wayne",photo,2392x1583,Visitors viewing an exhibit with elephant skeleton in foreground,,Bassett Associates,Bassett Associates files,James H. Bassett,,Available under a Creative Commons Attribution 4.0 International (CC BY 4.0) license,image/tiff,,StillImage
zoo_ftw_indo_pl_00,https://bassettassociates.s3.amazonaws.com/zoo/ftw/indo/zoo_ftw_indo_pl_00.jpg,"zoo,Fort Wayne",plan,1584x1068,"Close-up, plan for Indonesian Rain Forest exhibit, Fort Wayne Children's Zoo",,Bassett Associates,Bassett Associates files,James H. Bassett,,Available under a Creative Commons Attribution 4.0 International (CC BY 4.0) license,image/jpeg,en,StillImage
zoo_ftw_indo_pl_01,https://bassettassociates.s3.amazonaws.com/zoo/ftw/indo/zoo_ftw_indo_pl_01.jpg,"zoo,Fort Wayne",plan,3096x2120,"Plan for Indonesian Rain Forest exhibit, Fort Wayne Children's Zoo",,Bassett Associates,Bassett Associates files,James H. Bassett,,Available under a Creative Commons Attribution 4.0 International (CC BY 4.0) license,image/jpeg,en,StillImage
zoo_ftw_indo_sk_00,https://bassettassociates.s3.amazonaws.com/zoo/ftw/indo/zoo_ftw_indo_sk_00.tif,"zoo,Fort Wayne,artwork",sketch,710x622,"Entry building with pedestrians, Indonesian Rain Forest exhibit",,James H. Bassett,Bassett Associates files,James H. Bassett,,Available under a Creative Commons Attribution 4.0 International (CC BY 4.0) license,image/tiff,,StillImage
zoo_ftw_indo_sk_01,https://bassettassociates.s3.amazonaws.com/zoo/ftw/indo/zoo_ftw_indo_sk_01.jpg,"zoo,Fort Wayne,section",sketch,5025x1926,Section showing orangutan and rain forest exhibits with adjacent boardwalk,,James H. Bassett,Bassett Associates files,James H. Bassett,,Available under a Creative Commons Attribution 4.0 International (CC BY 4.0) license,image/jpeg,en,StillImage
zoo_kcz_africa_ph_00,https://bassettassociates.s3.amazonaws.com/zoo/kcz/africa/zoo_kcz_africa_ph_00.tif,"zoo,Kansas City",photo,3492x2389,Visitor observing livestock in a kraal,,Bassett Associates,Bassett Associates files,James H. Bassett,,Available under a Creative Commons Attribution 4.0 International (CC BY 4.0) license,image/tiff,,StillImage
zoo_kcz_africa_ph_01,https://bassettassociates.s3.amazonaws.com/zoo/kcz/africa/zoo_kcz_africa_ph_01.tif,"zoo,Kansas City,animal",photo,3375x2250,Cheetahs in front of rockwork,,Bassett Associates,Bassett Associates files,James H. Bassett,,Available under a Creative Commons Attribution 4.0 International (CC BY 4.0) license,image/tiff,,StillImage
zoo_kcz_africa_ph_02,https://bassettassociates.s3.amazonaws.com/zoo/kcz/africa/zoo_kcz_africa_ph_02.tif,"zoo,Kansas City,animal",photo,3437x2361,Cheetahs resting,,Bassett Associates,Bassett Associates files,James H. Bassett,,Available under a Creative Commons Attribution 4.0 International (CC BY 4.0) license,image/tiff,,StillImage
zoo_kcz_africa_ph_03,https://bassettassociates.s3.amazonaws.com/zoo/kcz/africa/zoo_kcz_africa_ph_03.tif,"zoo,Kansas City,animal",photo,1930x1524,Antelope near a water hole with visitors on an elevated walkway in the background,,Bassett Associates,Bassett Associates files,James H. Bassett,,Available under a Creative Commons Attribution 4.0 International (CC BY 4.0) license,image/tiff,,StillImage
zoo_kcz_africa_ph_04,https://bassettassociates.s3.amazonaws.com/zoo/kcz/africa/zoo_kcz_africa_ph_04.tif,"zoo,Kansas City,construction",photo,3546x2295,Rockwork under construction,,Bassett Associates,Bassett Associates files,James H. Bassett,,Available under a Creative Commons Attribution 4.0 International (CC BY 4.0) license,image/tiff,,StillImage
