Dublin Core:Identifier,upload_url,tags,Item Type Metadata:Original Format,Item Type Metadata:Physical Dimensions,Dublin Core:Title,Dublin Core:Description,Dublin Core:Creator,Dublin Core:Source,Dublin Core:Publisher,Dublin Core:Date,Dublin Core:Rights,Dublin Core:Format,Dublin Core:Language,Dublin Core:Type
report_blank-park-zoo_rp_2000,https://bassettassociates.s3.amazonaws.com/report/report_blank-park-zoo_rp_2000.pdf,"report,zoo,masterplan",printed report,,"Blank Park Zoo Master Plan, Des Moines, Iowa","This plan sought to develop and confirm strategic goals for the zoo and provide a planning framework for detailed design and development. This document includes part of the published plan, particularly the ""character sketches"" that includes artwork showing development themes.","RDG Crose Gardner Shukert, nc. with Bassett Associates as zoo planning consultants",Bassett Associates files,James H. Bassett,2000,Available under a Creative Commons Attribution 4.0 International (CC BY 4.0) license,application/pdf,en,Text
report_ft-wayne-zoo-australia_rp_1985,https://bassettassociates.s3.amazonaws.com/report/report_ft-wayne-zoo-australia_rp_1985.pdf,"report,zoo,masterplan",printed report,,"The Australian Adventure, Children's Zoo Fund Drive","An explanation of the plans for creating the Australian Adventure addition to support a capital fund drive. The zoo is located in Ft. Wayne, Indiana.",Bassett Associates and Earl B. Wells,Bassett Associates files,James H. Bassett,1985,Available under a Creative Commons Attribution 4.0 International (CC BY 4.0) license,application/pdf,en,Text
report_greenville-zoo_rp_2000,https://bassettassociates.s3.amazonaws.com/report/report_greenville-zoo_rp_2000.pdf,"report,zoo,masterplan",printed report,,Zoo 2000: Growing by Leaps and Bounds (The Campaign for the Greenville Zoo),"An explanation of the plans for enlarging this Greenvill, South Carolina zoo based on an updated master plan.",Bassett Associates,Bassett Associates files,James H. Bassett,2000,Available under a Creative Commons Attribution 4.0 International (CC BY 4.0) license,application/pdf,en,Text
report_louisville-zoo_rp_1992,https://bassettassociates.s3.amazonaws.com/report/report_louisville-zoo_rp_1992.pdf,"report,zoo,masterplan",printed report,,"A Botanical Master Plan for the Louisville Zoo, Our Natural Resource","The Botanical Master Plan highlights a landscape development that will complement the implementation of the physical master plan for this zoo in Louisville, Kentucky.",Bassett Associates and William Ray & Associates,Bassett Associates files,James H. Bassett,1992,Available under a Creative Commons Attribution 4.0 International (CC BY 4.0) license,application/pdf,en,Text
report_miller-park-zoo_rp_1974,https://bassettassociates.s3.amazonaws.com/report/report_miller-park-zoo_rp_1974.pdf,"report,zoo,masterplan",printed report,,Miller Park Zoo,"A plan to integrate education, recreation, and conservation with active visitor participation to support revenue-producing activities for this zoo in Bloomington, Illinois.","Earl B. Wells and James H. Bassett, Inc.",Bassett Associates files,James H. Bassett,1974,Available under a Creative Commons Attribution 4.0 International (CC BY 4.0) license,application/pdf,en,Text
report_potter-park-zoo_rp_1984,https://bassettassociates.s3.amazonaws.com/report/report_potter-park-zoo_rp_1984.pdf,"report,zoo,masterplan",printed report,,"Potter Park and Zoo, Lansing, Michigan: Master Plan of Redevelopment","A plan to increase visitor awareness and understanding of animals, and to reorganize vehicular and pedestrian circulation, parking, activity and service areas.","James H. Bassett, Inc. and Earl B. Wells",Bassett Associates files,James H. Bassett,1984,Available under a Creative Commons Attribution 4.0 International (CC BY 4.0) license,application/pdf,en,Text
report_tautphaus-park-zoo_rp_1998,https://bassettassociates.s3.amazonaws.com/report/report_tautphaus-park-zoo_rp_1998.pdf,"report,zoo,masterplan",printed report,,Tautphaus Park Zoo Master Plan,"A plan prepared for the Citiy of Idaho Falls, Idaho to offer visitors a unique experience and to redevelop the zo with better parking and circulation.",Bassett Associates and Earl B. Wells,Bassett Associates files,James H. Bassett,1998,Available under a Creative Commons Attribution 4.0 International (CC BY 4.0) license,application/pdf,en,Text
report_willow-park-zoo_rp_2004,https://bassettassociates.s3.amazonaws.com/report/report_willow-park-zoo_rp_2004.pdf,"report,zoo,masterplan",printed report,,Willow Park Zoo 2004-2015 Master Plan,"A guiding document for Logan, Utah for future development of a ten year period.",Bassett Associates and Earl B. Wells,Bassett Associates files,James H. Bassett,2004,Available under a Creative Commons Attribution 4.0 International (CC BY 4.0) license,application/pdf,en,Text
